{
  "$schema": "knowledge-schema.json",
  "tier": 5,
  "tierName": "dynamic",
  "domain": "general",
  "lastUpdated": "2026-01-18",
  "lastVerified": "2026-01-18",
  "confidence": "low",
  "sources": [
    {
      "name": "Gemini Deep Research",
      "type": "gemini-research",
      "date": "2026-01-18"
    }
  ],
  "entries": [
    {
      "id": "best-mac-gaming-2025",
      "fact": "For Mac gaming in early 2025, M3 Max or M4 Pro provide best balance of performance and availability",
      "details": "M4 Max expected mid-2025; may shift recommendations",
      "confidence": "low",
      "source": "Market analysis",
      "verificationRequired": true,
      "lastVerified": "2026-01-18",
      "tags": ["recommendation", "mac", "gaming", "2025"]
    },
    {
      "id": "metal-game-ports-trend",
      "fact": "AAA Metal ports increasing: Recent additions include Cyberpunk 2077, Baldur's Gate 3, Resident Evil Village",
      "details": "Trend expected to continue with Apple's focus on gaming",
      "confidence": "low",
      "source": "Industry tracking",
      "verificationRequired": true,
      "lastVerified": "2026-01-18",
      "tags": ["metal", "ports", "games", "trend"]
    },
    {
      "id": "crossover-wine-status",
      "fact": "CrossOver/Wine compatibility continues improving; many Windows games playable without native ports",
      "details": "Check CrossOver compatibility database for specific titles",
      "confidence": "low",
      "source": "Compatibility tracking",
      "verificationRequired": true,
      "lastVerified": "2026-01-18",
      "tags": ["crossover", "wine", "compatibility"]
    },
    {
      "id": "game-mode-macos",
      "fact": "macOS Sonoma Game Mode prioritizes gaming workloads and reduces AirPods/controller latency",
      "details": "Automatically activates for full-screen games",
      "confidence": "medium",
      "source": "Apple documentation",
      "verificationRequired": true,
      "lastVerified": "2026-01-18",
      "tags": ["game-mode", "macos", "sonoma"]
    }
  ]
}
